{
  "$schema": "https://json-schema.org/draft/2020-12/schema",
  "$id": "veil:clue",
  "title": "Clue",
  "type": "object",
  "additionalProperties": false,
  "required": ["id", "case_id", "name"],
  "properties": {
    "id":          { "type": "string", "pattern": "^[a-z0-9_-]+$" },
    "case_id":     { "type": "string", "pattern": "^[a-z0-9_]+$" },
    "name":        { "type": "string", "minLength": 1 },
    "description": { "type": "string" },
    "location":    { "type": "string" },
    "reveals":     { "type": "string" },
    "extra":       { "type": "object" }
  }
}
